{
  "schemaVersion": "0.1.0",
  "eventId": "orion-evt-facility-risk-field-report",
  "eventType": "field_report.operator_observation",
  "title": "Operator field report confirms local disruption",
  "summary": "Synthetic operator report indicates visible smoke, impaired access, and degraded local communications near the facility corridor.",
  "observedAt": "2026-05-29T12:06:00Z",
  "validUntil": "2026-05-29T15:06:00Z",
  "location": {
    "type": "Point",
    "coordinates": [-121.4970, 38.5790]
  },
  "severity": "medium",
  "confidence": 0.55,
  "sourceRecordRefs": ["gaia-src-facility-risk-field-report"],
  "assetRefs": ["asset.synthetic-facility-alpha"],
  "evidenceGrade": "operator_report.unverified",
  "policyState": "unverified_source",
  "tags": ["facility-risk", "field-report", "operator-report", "fixture"]
}
