{
  "schemaVersion": "0.1.0",
  "eventId": "orion-evt-facility-risk-cve-exposure",
  "eventType": "cyber.cve_exposure",
  "title": "Synthetic CVE exposure for facility vendor stack",
  "summary": "A synthetic CVE exposure affects the modeled facility vendor stack. This is passive enrichment only and does not authorize scanning or exploitation.",
  "observedAt": "2026-05-29T12:02:00Z",
  "validUntil": "2026-06-05T12:02:00Z",
  "location": {
    "type": "Point",
    "coordinates": [-121.5000, 38.5800]
  },
  "severity": "high",
  "confidence": 0.65,
  "sourceRecordRefs": ["gaia-src-facility-risk-cve-exposure"],
  "assetRefs": ["asset.synthetic-facility-alpha"],
  "evidenceGrade": "fixture.synthetic",
  "policyState": "action_gated",
  "tags": ["facility-risk", "cyber", "cve", "fixture", "passive-enrichment-only"]
}
